{
  "schema_version": 1,
  "task_id": "{{TASK_ID}}",
  "design_candidate_hash": "{{DESIGN_CANDIDATE_SHA256}}",
  "requirements_hash": "{{REQUIREMENTS_SHA256}}",
  "reviews": [
    {
      "review_id": "REVIEW-ARCH-001",
      "review_run_id": "{{ARCHITECTURE_REVIEW_RUN_ID}}",
      "lens": "architecture",
      "model_route": "{{ARCHITECTURE_REVIEW_ROUTE}}",
      "transcript_sha256": "{{ARCHITECTURE_REVIEW_TRANSCRIPT_SHA256}}",
      "authority": "blocking",
      "snapshot_reproduced": true,
      "start_snapshot_hash": "{{DESIGN_CANDIDATE_SHA256}}",
      "end_snapshot_hash": "{{DESIGN_CANDIDATE_SHA256}}",
      "verdicts": [
        {
          "requirement_id": "REQ-001",
          "status": "satisfied",
          "evidence": "{{ARCHITECTURE_EVIDENCE}}",
          "finding_ids": []
        }
      ],
      "findings": []
    },
    {
      "review_id": "REVIEW-SEC-001",
      "review_run_id": "{{SECURITY_REVIEW_RUN_ID}}",
      "lens": "security",
      "model_route": "{{SECURITY_REVIEW_ROUTE}}",
      "transcript_sha256": "{{SECURITY_REVIEW_TRANSCRIPT_SHA256}}",
      "authority": "blocking",
      "snapshot_reproduced": true,
      "start_snapshot_hash": "{{DESIGN_CANDIDATE_SHA256}}",
      "end_snapshot_hash": "{{DESIGN_CANDIDATE_SHA256}}",
      "verdicts": [
        {
          "requirement_id": "REQ-001",
          "status": "satisfied",
          "evidence": "{{SECURITY_EVIDENCE}}",
          "finding_ids": []
        }
      ],
      "findings": []
    }
  ]
}
